{
  "columns": {
    "heating_demand": {
      "quantity": "power",
      "unit": "W"
    }
  },
  "description": "Daily-average heating demand of 2027: peak 30.0 MWth, 111.67 GWh/year.",
  "name": "heating_demand",
  "source": "GEMINI_Heating_Demand_Daily_2027.csv, GEMINI Hackathon challenge requirements, 28 October 2026, section 2",
  "time": [
    "2027-01-01T00:00:00+00:00",
    "2027-01-02T00:00:00+00:00",
    "2027-01-03T00:00:00+00:00",
    "2027-01-04T00:00:00+00:00"
  ],
  "values": {
    "heating_demand": [
      24313000.0,
      22984000.0,
      23218000.0,
      26234000.0
    ]
  }
}
